"No.","Time","Source","Destination","Protocol","Length","Info"
"1","2023-05-06 19:37:37.507369","52.212.101.251","192.168.18.48","TCP","54","443  >  50596 [ACK] Seq=1 Ack=1 Win=110 Len=0"
"2","2023-05-06 19:37:37.507369","52.212.101.251","192.168.18.48","TLSv1.2","165","Server Hello"
"3","2023-05-06 19:37:37.507369","52.212.101.251","192.168.18.48","TLSv1.2","60","Change Cipher Spec"
"4","2023-05-06 19:37:37.507369","52.212.101.251","192.168.18.48","TLSv1.2","99","Encrypted Handshake Message"
"5","2023-05-06 19:37:37.507469","192.168.18.48","52.212.101.251","TCP","54","50596  >  443 [ACK] Seq=1 Ack=163 Win=258 Len=0"
"6","2023-05-06 19:37:37.508124","192.168.18.48","52.212.101.251","TLSv1.2","105","Change Cipher Spec, Encrypted Handshake Message"
"7","2023-05-06 19:37:37.508369","192.168.18.48","52.212.101.251","TLSv1.2","381","Application Data"
"8","2023-05-06 19:37:37.508439","192.168.18.48","52.212.101.251","TLSv1.2","507","Application Data"
"9","2023-05-06 19:37:37.519714","2.17.179.243","192.168.18.48","TCP","54","443  >  50595 [ACK] Seq=1 Ack=1 Win=501 Len=0"
"10","2023-05-06 19:37:37.545320","2.17.179.243","192.168.18.48","TCP","1466","443  >  50595 [ACK] Seq=1 Ack=1 Win=501 Len=1412 [TCP segment of a reassembled PDU]"
"11","2023-05-06 19:37:37.545320","2.17.179.243","192.168.18.48","TLSv1.2","552","Application Data"
"12","2023-05-06 19:37:37.545391","192.168.18.48","2.17.179.243","TCP","54","50595  >  443 [ACK] Seq=1 Ack=1911 Win=259 Len=0"
"13","2023-05-06 19:37:37.546481","192.168.18.48","2.17.179.243","TLSv1.2","85","Encrypted Alert"
"14","2023-05-06 19:37:37.546638","192.168.18.48","2.17.179.243","TCP","54","50595  >  443 [FIN, ACK] Seq=32 Ack=1911 Win=259 Len=0"
"15","2023-05-06 19:37:37.594822","192.168.18.48","2.17.179.243","TCP","66","50599  >  443 [SYN] Seq=0 Win=64240 Len=0 MSS=1460 WS=256 SACK_PERM"
"16","2023-05-06 19:37:37.632337","192.168.18.48","224.0.0.251","MDNS","85","Standard query 0x0000 PTR _microsoft_mcc._tcp.local, ""QU"" question"
"17","2023-05-06 19:37:37.632899","fe80::25c9:3a77:9a74:3da9","ff02::fb","MDNS","105","Standard query 0x0000 PTR _microsoft_mcc._tcp.local, ""QU"" question"
"18","2023-05-06 19:37:37.640479","2407:d000:b:7008:5d49:e746:bd25:c0b5","2a00:1450:4018:809::200e","UDP","91","58033  >  443 Len=29"
"19","2023-05-06 19:37:37.687273","52.212.101.251","192.168.18.48","TCP","54","443  >  50596 [ACK] Seq=163 Ack=52 Win=110 Len=0"
"20","2023-05-06 19:37:37.687273","52.212.101.251","192.168.18.48","TCP","54","443  >  50596 [ACK] Seq=163 Ack=379 Win=114 Len=0"
"21","2023-05-06 19:37:37.687273","52.212.101.251","192.168.18.48","TCP","54","443  >  50596 [ACK] Seq=163 Ack=832 Win=118 Len=0"
"22","2023-05-06 19:37:37.687273","52.212.101.251","192.168.18.48","TLSv1.2","317","Application Data"
"23","2023-05-06 19:37:37.692586","2a00:1450:4018:809::200e","2407:d000:b:7008:5d49:e746:bd25:c0b5","UDP","88","443  >  58033 Len=26"
"24","2023-05-06 19:37:37.692665","2.17.179.243","192.168.18.48","TCP","54","443  >  50595 [ACK] Seq=1911 Ack=32 Win=501 Len=0"
"25","2023-05-06 19:37:37.704899","2.17.179.243","192.168.18.48","TLSv1.2","85","Encrypted Alert"
"26","2023-05-06 19:37:37.704974","192.168.18.48","2.17.179.243","TCP","54","50595  >  443 [RST, ACK] Seq=33 Ack=1942 Win=0 Len=0"
"27","2023-05-06 19:37:37.707158","2.17.179.243","192.168.18.48","TCP","54","443  >  50595 [FIN, ACK] Seq=1942 Ack=33 Win=501 Len=0"
"28","2023-05-06 19:37:37.738280","192.168.18.48","52.212.101.251","TCP","54","50596  >  443 [ACK] Seq=832 Ack=426 Win=257 Len=0"
"29","2023-05-06 19:37:37.743332","2.17.179.243","192.168.18.48","TCP","66","443  >  50599 [SYN, ACK] Seq=0 Ack=1 Win=64240 Len=0 MSS=1412 SACK_PERM WS=128"
"30","2023-05-06 19:37:37.743422","192.168.18.48","2.17.179.243","TCP","54","50599  >  443 [ACK] Seq=1 Ack=1 Win=66304 Len=0"
"31","2023-05-06 19:37:37.743874","192.168.18.48","2.17.179.243","TLSv1.2","251","Client Hello"
"32","2023-05-06 19:37:37.893638","2.17.179.243","192.168.18.48","TCP","54","443  >  50599 [ACK] Seq=1 Ack=198 Win=64128 Len=0"
"33","2023-05-06 19:37:37.897709","2.17.179.243","192.168.18.48","TLSv1.2","1466","Server Hello"
"34","2023-05-06 19:37:37.898514","2.17.179.243","192.168.18.48","TCP","1466","443  >  50599 [PSH, ACK] Seq=1413 Ack=198 Win=64128 Len=1412 [TCP segment of a reassembled PDU]"
"35","2023-05-06 19:37:37.898556","192.168.18.48","2.17.179.243","TCP","54","50599  >  443 [ACK] Seq=198 Ack=2825 Win=66304 Len=0"
"36","2023-05-06 19:37:37.899358","2.17.179.243","192.168.18.48","TLSv1.2","1126","Certificate, Certificate Status, Server Key Exchange, Server Hello Done"
"37","2023-05-06 19:37:37.899658","2407:d000:b:7008:5d49:e746:bd25:c0b5","2a00:1450:4018:809::200e","UDP","91","58033  >  443 Len=29"
"38","2023-05-06 19:37:37.900395","192.168.18.48","2.17.179.243","TLSv1.2","180","Client Key Exchange, Change Cipher Spec, Encrypted Handshake Message"
"39","2023-05-06 19:37:37.936220","192.168.18.48","2.17.179.243","TCP","66","50722  >  443 [SYN] Seq=0 Win=64240 Len=0 MSS=1460 WS=256 SACK_PERM"
"40","2023-05-06 19:37:37.946376","2a00:1450:4018:809::200e","2407:d000:b:7008:5d49:e746:bd25:c0b5","UDP","88","443  >  58033 Len=26"
"41","2023-05-06 19:37:37.990964","192.168.18.48","2.17.179.243","TCP","66","50745  >  443 [SYN] Seq=0 Win=64240 Len=0 MSS=1460 WS=256 SACK_PERM"
"42","2023-05-06 19:37:37.994669","192.168.18.48","2.17.179.243","TCP","66","50746  >  443 [SYN] Seq=0 Win=64240 Len=0 MSS=1460 WS=256 SACK_PERM"
"43","2023-05-06 19:37:37.995948","192.168.18.48","2.17.179.243","TCP","66","50747  >  443 [SYN] Seq=0 Win=64240 Len=0 MSS=1460 WS=256 SACK_PERM"
"44","2023-05-06 19:37:37.997127","192.168.18.48","2.17.179.243","TCP","66","50748  >  443 [SYN] Seq=0 Win=64240 Len=0 MSS=1460 WS=256 SACK_PERM"
"45","2023-05-06 19:37:37.998281","192.168.18.48","2.17.179.243","TCP","66","50749  >  443 [SYN] Seq=0 Win=64240 Len=0 MSS=1460 WS=256 SACK_PERM"
"46","2023-05-06 19:37:37.999424","192.168.18.48","2.17.179.243","TCP","66","50750  >  443 [SYN] Seq=0 Win=64240 Len=0 MSS=1460 WS=256 SACK_PERM"
"47","2023-05-06 19:37:38.000452","192.168.18.48","2.17.179.243","TCP","66","50751  >  443 [SYN] Seq=0 Win=64240 Len=0 MSS=1460 WS=256 SACK_PERM"
"48","2023-05-06 19:37:38.001597","192.168.18.48","2.17.179.243","TCP","66","50752  >  443 [SYN] Seq=0 Win=64240 Len=0 MSS=1460 WS=256 SACK_PERM"
"49","2023-05-06 19:37:38.002749","192.168.18.48","2.17.179.243","TCP","66","50753  >  443 [SYN] Seq=0 Win=64240 Len=0 MSS=1460 WS=256 SACK_PERM"
"50","2023-05-06 19:37:38.003974","192.168.18.48","2.17.179.243","TCP","66","50754  >  443 [SYN] Seq=0 Win=64240 Len=0 MSS=1460 WS=256 SACK_PERM"
"51","2023-05-06 19:37:38.005040","192.168.18.48","2.17.179.243","TCP","66","50755  >  443 [SYN] Seq=0 Win=64240 Len=0 MSS=1460 WS=256 SACK_PERM"
"52","2023-05-06 19:37:38.006546","192.168.18.48","2.17.179.243","TCP","66","50756  >  443 [SYN] Seq=0 Win=64240 Len=0 MSS=1460 WS=256 SACK_PERM"
"53","2023-05-06 19:37:38.007987","192.168.18.48","2.17.179.243","TCP","66","50757  >  443 [SYN] Seq=0 Win=64240 Len=0 MSS=1460 WS=256 SACK_PERM"
"54","2023-05-06 19:37:38.009348","192.168.18.48","2.17.179.243","TCP","66","50758  >  443 [SYN] Seq=0 Win=64240 Len=0 MSS=1460 WS=256 SACK_PERM"
"55","2023-05-06 19:37:38.011087","192.168.18.48","2.17.179.243","TCP","66","50759  >  443 [SYN] Seq=0 Win=64240 Len=0 MSS=1460 WS=256 SACK_PERM"
"56","2023-05-06 19:37:38.012167","192.168.18.48","2.17.179.243","TCP","66","50760  >  443 [SYN] Seq=0 Win=64240 Len=0 MSS=1460 WS=256 SACK_PERM"
"57","2023-05-06 19:37:38.013250","192.168.18.48","2.17.179.243","TCP","66","50761  >  443 [SYN] Seq=0 Win=64240 Len=0 MSS=1460 WS=256 SACK_PERM"
"58","2023-05-06 19:37:38.014338","192.168.18.48","2.17.179.243","TCP","66","50762  >  443 [SYN] Seq=0 Win=64240 Len=0 MSS=1460 WS=256 SACK_PERM"
"59","2023-05-06 19:37:38.015902","192.168.18.48","2.17.179.243","TCP","66","50763  >  443 [SYN] Seq=0 Win=64240 Len=0 MSS=1460 WS=256 SACK_PERM"
"60","2023-05-06 19:37:38.016899","192.168.18.48","2.17.179.243","TCP","66","50764  >  443 [SYN] Seq=0 Win=64240 Len=0 MSS=1460 WS=256 SACK_PERM"
"61","2023-05-06 19:37:38.018832","192.168.18.48","2.17.179.243","TCP","66","50765  >  443 [SYN] Seq=0 Win=64240 Len=0 MSS=1460 WS=256 SACK_PERM"
"62","2023-05-06 19:37:38.020560","192.168.18.48","2.17.179.243","TCP","66","50766  >  443 [SYN] Seq=0 Win=64240 Len=0 MSS=1460 WS=256 SACK_PERM"
"63","2023-05-06 19:37:38.021879","192.168.18.48","2.17.179.243","TCP","66","50767  >  443 [SYN] Seq=0 Win=64240 Len=0 MSS=1460 WS=256 SACK_PERM"
"64","2023-05-06 19:37:38.023553","192.168.18.48","2.17.179.243","TCP","66","50768  >  443 [SYN] Seq=0 Win=64240 Len=0 MSS=1460 WS=256 SACK_PERM"
"65","2023-05-06 19:37:38.024609","192.168.18.48","2.17.179.243","TCP","66","50769  >  443 [SYN] Seq=0 Win=64240 Len=0 MSS=1460 WS=256 SACK_PERM"
"66","2023-05-06 19:37:38.026234","192.168.18.48","2.17.179.243","TCP","66","50770  >  443 [SYN] Seq=0 Win=64240 Len=0 MSS=1460 WS=256 SACK_PERM"
"67","2023-05-06 19:37:38.027214","192.168.18.48","2.17.179.243","TCP","66","50771  >  443 [SYN] Seq=0 Win=64240 Len=0 MSS=1460 WS=256 SACK_PERM"
"68","2023-05-06 19:37:38.028415","192.168.18.48","2.17.179.243","TCP","66","50772  >  443 [SYN] Seq=0 Win=64240 Len=0 MSS=1460 WS=256 SACK_PERM"
"69","2023-05-06 19:37:38.029549","192.168.18.48","2.17.179.243","TCP","66","50773  >  443 [SYN] Seq=0 Win=64240 Len=0 MSS=1460 WS=256 SACK_PERM"
"70","2023-05-06 19:37:38.030683","192.168.18.48","2.17.179.243","TCP","66","50774  >  443 [SYN] Seq=0 Win=64240 Len=0 MSS=1460 WS=256 SACK_PERM"
"71","2023-05-06 19:37:38.031845","192.168.18.48","2.17.179.243","TCP","66","50775  >  443 [SYN] Seq=0 Win=64240 Len=0 MSS=1460 WS=256 SACK_PERM"
"72","2023-05-06 19:37:38.032965","192.168.18.48","2.17.179.243","TCP","66","50776  >  443 [SYN] Seq=0 Win=64240 Len=0 MSS=1460 WS=256 SACK_PERM"
"73","2023-05-06 19:37:38.034133","192.168.18.48","2.17.179.243","TCP","66","50777  >  443 [SYN] Seq=0 Win=64240 Len=0 MSS=1460 WS=256 SACK_PERM"
"74","2023-05-06 19:37:38.035550","192.168.18.48","2.17.179.243","TCP","66","50778  >  443 [SYN] Seq=0 Win=64240 Len=0 MSS=1460 WS=256 SACK_PERM"
"75","2023-05-06 19:37:38.037066","192.168.18.48","2.17.179.243","TCP","66","50779  >  443 [SYN] Seq=0 Win=64240 Len=0 MSS=1460 WS=256 SACK_PERM"
"76","2023-05-06 19:37:38.038262","192.168.18.48","2.17.179.243","TCP","66","50780  >  443 [SYN] Seq=0 Win=64240 Len=0 MSS=1460 WS=256 SACK_PERM"
"77","2023-05-06 19:37:38.039280","192.168.18.48","2.17.179.243","TCP","66","50781  >  443 [SYN] Seq=0 Win=64240 Len=0 MSS=1460 WS=256 SACK_PERM"
"78","2023-05-06 19:37:38.040863","192.168.18.48","2.17.179.243","TCP","66","50782  >  443 [SYN] Seq=0 Win=64240 Len=0 MSS=1460 WS=256 SACK_PERM"
"79","2023-05-06 19:37:38.041972","192.168.18.48","2.17.179.243","TCP","66","50783  >  443 [SYN] Seq=0 Win=64240 Len=0 MSS=1460 WS=256 SACK_PERM"
"80","2023-05-06 19:37:38.043199","192.168.18.48","2.17.179.243","TCP","66","50784  >  443 [SYN] Seq=0 Win=64240 Len=0 MSS=1460 WS=256 SACK_PERM"
"81","2023-05-06 19:37:38.044414","192.168.18.48","2.17.179.243","TCP","66","50785  >  443 [SYN] Seq=0 Win=64240 Len=0 MSS=1460 WS=256 SACK_PERM"
"82","2023-05-06 19:37:38.045796","192.168.18.48","2.17.179.243","TCP","66","50786  >  443 [SYN] Seq=0 Win=64240 Len=0 MSS=1460 WS=256 SACK_PERM"
"83","2023-05-06 19:37:38.046626","192.168.18.48","2.17.179.243","TCP","66","50787  >  443 [SYN] Seq=0 Win=64240 Len=0 MSS=1460 WS=256 SACK_PERM"
"84","2023-05-06 19:37:38.047860","192.168.18.48","2.17.179.243","TCP","66","50788  >  443 [SYN] Seq=0 Win=64240 Len=0 MSS=1460 WS=256 SACK_PERM"
"85","2023-05-06 19:37:38.048905","192.168.18.48","2.17.179.243","TCP","66","50789  >  443 [SYN] Seq=0 Win=64240 Len=0 MSS=1460 WS=256 SACK_PERM"
"86","2023-05-06 19:37:38.050015","192.168.18.48","2.17.179.243","TCP","66","50790  >  443 [SYN] Seq=0 Win=64240 Len=0 MSS=1460 WS=256 SACK_PERM"
"87","2023-05-06 19:37:38.051084","2.17.179.243","192.168.18.48","TCP","54","443  >  50599 [ACK] Seq=3897 Ack=324 Win=64128 Len=0"
"88","2023-05-06 19:37:38.051255","192.168.18.48","2.17.179.243","TCP","66","50791  >  443 [SYN] Seq=0 Win=64240 Len=0 MSS=1460 WS=256 SACK_PERM"
"89","2023-05-06 19:37:38.052516","192.168.18.48","2.17.179.243","TCP","66","50792  >  443 [SYN] Seq=0 Win=64240 Len=0 MSS=1460 WS=256 SACK_PERM"
"90","2023-05-06 19:37:38.053509","192.168.18.48","2.17.179.243","TCP","66","50793  >  443 [SYN] Seq=0 Win=64240 Len=0 MSS=1460 WS=256 SACK_PERM"
"91","2023-05-06 19:37:38.055054","192.168.18.48","2.17.179.243","TCP","66","50794  >  443 [SYN] Seq=0 Win=64240 Len=0 MSS=1460 WS=256 SACK_PERM"
"92","2023-05-06 19:37:38.056391","192.168.18.48","2.17.179.243","TCP","66","50795  >  443 [SYN] Seq=0 Win=64240 Len=0 MSS=1460 WS=256 SACK_PERM"
"93","2023-05-06 19:37:38.057942","192.168.18.48","2.17.179.243","TCP","66","50796  >  443 [SYN] Seq=0 Win=64240 Len=0 MSS=1460 WS=256 SACK_PERM"
"94","2023-05-06 19:37:38.058937","192.168.18.48","2.17.179.243","TCP","66","50797  >  443 [SYN] Seq=0 Win=64240 Len=0 MSS=1460 WS=256 SACK_PERM"
"95","2023-05-06 19:37:38.059111","2.17.179.243","192.168.18.48","TLSv1.2","312","New Session Ticket, Change Cipher Spec, Encrypted Handshake Message"
"96","2023-05-06 19:37:38.059512","192.168.18.48","2.17.179.243","TLSv1.2","220","Application Data"
"97","2023-05-06 19:37:38.060100","192.168.18.48","2.17.179.243","TCP","66","50798  >  443 [SYN] Seq=0 Win=64240 Len=0 MSS=1460 WS=256 SACK_PERM"
"98","2023-05-06 19:37:38.061319","192.168.18.48","2.17.179.243","TCP","66","50799  >  443 [SYN] Seq=0 Win=64240 Len=0 MSS=1460 WS=256 SACK_PERM"
"99","2023-05-06 19:37:38.063580","192.168.18.48","2.17.179.243","TCP","66","50800  >  443 [SYN] Seq=0 Win=64240 Len=0 MSS=1460 WS=256 SACK_PERM"
"100","2023-05-06 19:37:38.086832","2.17.179.243","192.168.18.48","TCP","66","443  >  50722 [SYN, ACK] Seq=0 Ack=1 Win=64240 Len=0 MSS=1412 SACK_PERM WS=128"
"101","2023-05-06 19:37:38.087007","192.168.18.48","2.17.179.243","TCP","54","50722  >  443 [ACK] Seq=1 Ack=1 Win=66304 Len=0"
"102","2023-05-06 19:37:38.091565","192.168.18.48","2.17.179.243","TLSv1.2","251","Client Hello"
"103","2023-05-06 19:37:38.099553","192.168.18.48","2.17.179.243","TCP","66","50801  >  443 [SYN] Seq=0 Win=64240 Len=0 MSS=1460 WS=256 SACK_PERM"
"104","2023-05-06 19:37:38.102242","192.168.18.48","2.17.179.243","TCP","66","50802  >  443 [SYN] Seq=0 Win=64240 Len=0 MSS=1460 WS=256 SACK_PERM"
"105","2023-05-06 19:37:38.103718","192.168.18.48","2.17.179.243","TCP","66","50803  >  443 [SYN] Seq=0 Win=64240 Len=0 MSS=1460 WS=256 SACK_PERM"
"106","2023-05-06 19:37:38.105053","192.168.18.48","2.17.179.243","TCP","66","50804  >  443 [SYN] Seq=0 Win=64240 Len=0 MSS=1460 WS=256 SACK_PERM"
"107","2023-05-06 19:37:38.106556","192.168.18.48","2.17.179.243","TCP","66","50805  >  443 [SYN] Seq=0 Win=64240 Len=0 MSS=1460 WS=256 SACK_PERM"
"108","2023-05-06 19:37:38.107928","192.168.18.48","2.17.179.243","TCP","66","50806  >  443 [SYN] Seq=0 Win=64240 Len=0 MSS=1460 WS=256 SACK_PERM"
"109","2023-05-06 19:37:38.113528","192.168.18.48","2.17.179.243","TCP","66","50807  >  443 [SYN] Seq=0 Win=64240 Len=0 MSS=1460 WS=256 SACK_PERM"
"110","2023-05-06 19:37:38.114630","192.168.18.48","2.17.179.243","TCP","66","50808  >  443 [SYN] Seq=0 Win=64240 Len=0 MSS=1460 WS=256 SACK_PERM"
"111","2023-05-06 19:37:38.116948","192.168.18.48","2.17.179.243","TCP","66","50809  >  443 [SYN] Seq=0 Win=64240 Len=0 MSS=1460 WS=256 SACK_PERM"
"112","2023-05-06 19:37:38.119814","192.168.18.48","2.17.179.243","TCP","66","50810  >  443 [SYN] Seq=0 Win=64240 Len=0 MSS=1460 WS=256 SACK_PERM"
"113","2023-05-06 19:37:38.120842","192.168.18.48","2.17.179.243","TCP","66","50811  >  443 [SYN] Seq=0 Win=64240 Len=0 MSS=1460 WS=256 SACK_PERM"
"114","2023-05-06 19:37:38.121922","192.168.18.48","2.17.179.243","TCP","66","50812  >  443 [SYN] Seq=0 Win=64240 Len=0 MSS=1460 WS=256 SACK_PERM"
"115","2023-05-06 19:37:38.122988","192.168.18.48","2.17.179.243","TCP","66","50813  >  443 [SYN] Seq=0 Win=64240 Len=0 MSS=1460 WS=256 SACK_PERM"
"116","2023-05-06 19:37:38.124179","192.168.18.48","2.17.179.243","TCP","66","50814  >  443 [SYN] Seq=0 Win=64240 Len=0 MSS=1460 WS=256 SACK_PERM"
"117","2023-05-06 19:37:38.125114","192.168.18.48","2.17.179.243","TCP","66","50815  >  443 [SYN] Seq=0 Win=64240 Len=0 MSS=1460 WS=256 SACK_PERM"
"118","2023-05-06 19:37:38.131819","2.17.179.243","192.168.18.48","TCP","66","443  >  50745 [SYN, ACK] Seq=0 Ack=1 Win=64240 Len=0 MSS=1412 SACK_PERM WS=128"
"119","2023-05-06 19:37:38.131921","192.168.18.48","2.17.179.243","TCP","54","50745  >  443 [ACK] Seq=1 Ack=1 Win=66304 Len=0"
"120","2023-05-06 19:37:38.132616","192.168.18.48","2.17.179.243","TLSv1.2","251","Client Hello"
"121","2023-05-06 19:37:38.138228","2.17.179.243","192.168.18.48","TCP","66","443  >  50748 [SYN, ACK] Seq=0 Ack=1 Win=64240 Len=0 MSS=1412 SACK_PERM WS=128"
"122","2023-05-06 19:37:38.138348","192.168.18.48","2.17.179.243","TCP","54","50748  >  443 [ACK] Seq=1 Ack=1 Win=66304 Len=0"
"123","2023-05-06 19:37:38.139079","192.168.18.48","2.17.179.243","TLSv1.2","251","Client Hello"
"124","2023-05-06 19:37:38.145910","2.17.179.243","192.168.18.48","TCP","66","443  >  50755 [SYN, ACK] Seq=0 Ack=1 Win=64240 Len=0 MSS=1412 SACK_PERM WS=128"
"125","2023-05-06 19:37:38.145910","2.17.179.243","192.168.18.48","TCP","66","443  >  50753 [SYN, ACK] Seq=0 Ack=1 Win=64240 Len=0 MSS=1412 SACK_PERM WS=128"
"126","2023-05-06 19:37:38.146103","192.168.18.48","2.17.179.243","TCP","54","50755  >  443 [ACK] Seq=1 Ack=1 Win=66304 Len=0"
"127","2023-05-06 19:37:38.146169","192.168.18.48","2.17.179.243","TCP","54","50753  >  443 [ACK] Seq=1 Ack=1 Win=66304 Len=0"
"128","2023-05-06 19:37:38.146371","2.17.179.243","192.168.18.48","TCP","66","443  >  50750 [SYN, ACK] Seq=0 Ack=1 Win=64240 Len=0 MSS=1412 SACK_PERM WS=128"
"129","2023-05-06 19:37:38.146371","2.17.179.243","192.168.18.48","TCP","66","443  >  50749 [SYN, ACK] Seq=0 Ack=1 Win=64240 Len=0 MSS=1412 SACK_PERM WS=128"
"130","2023-05-06 19:37:38.146371","2.17.179.243","192.168.18.48","TCP","66","443  >  50754 [SYN, ACK] Seq=0 Ack=1 Win=64240 Len=0 MSS=1412 SACK_PERM WS=128"
"131","2023-05-06 19:37:38.146504","192.168.18.48","2.17.179.243","TCP","54","50750  >  443 [ACK] Seq=1 Ack=1 Win=66304 Len=0"
"132","2023-05-06 19:37:38.146559","192.168.18.48","2.17.179.243","TCP","54","50749  >  443 [ACK] Seq=1 Ack=1 Win=66304 Len=0"
"133","2023-05-06 19:37:38.146580","192.168.18.48","2.17.179.243","TCP","54","50754  >  443 [ACK] Seq=1 Ack=1 Win=66304 Len=0"
"134","2023-05-06 19:37:38.146775","192.168.18.48","2.17.179.243","TLSv1.2","251","Client Hello"
"135","2023-05-06 19:37:38.146794","192.168.18.48","2.17.179.243","TLSv1.2","251","Client Hello"
"136","2023-05-06 19:37:38.146893","192.168.18.48","2.17.179.243","TLSv1.2","251","Client Hello"
"137","2023-05-06 19:37:38.146976","192.168.18.48","2.17.179.243","TLSv1.2","251","Client Hello"
"138","2023-05-06 19:37:38.147043","192.168.18.48","2.17.179.243","TLSv1.2","251","Client Hello"
"139","2023-05-06 19:37:38.149710","2.17.179.243","192.168.18.48","TCP","66","443  >  50751 [SYN, ACK] Seq=0 Ack=1 Win=64240 Len=0 MSS=1412 SACK_PERM WS=128"
"140","2023-05-06 19:37:38.149818","192.168.18.48","2.17.179.243","TCP","54","50751  >  443 [ACK] Seq=1 Ack=1 Win=66304 Len=0"
"141","2023-05-06 19:37:38.150297","2.17.179.243","192.168.18.48","TCP","66","443  >  50747 [SYN, ACK] Seq=0 Ack=1 Win=64240 Len=0 MSS=1412 SACK_PERM WS=128"
"142","2023-05-06 19:37:38.150405","192.168.18.48","2.17.179.243","TCP","54","50747  >  443 [ACK] Seq=1 Ack=1 Win=66304 Len=0"
"143","2023-05-06 19:37:38.150426","192.168.18.48","2.17.179.243","TLSv1.2","251","Client Hello"
"144","2023-05-06 19:37:38.150916","192.168.18.48","2.17.179.243","TLSv1.2","251","Client Hello"
"145","2023-05-06 19:37:38.151903","2.17.179.243","192.168.18.48","TCP","66","443  >  50746 [SYN, ACK] Seq=0 Ack=1 Win=64240 Len=0 MSS=1412 SACK_PERM WS=128"
"146","2023-05-06 19:37:38.151903","2.17.179.243","192.168.18.48","TCP","66","443  >  50756 [SYN, ACK] Seq=0 Ack=1 Win=64240 Len=0 MSS=1412 SACK_PERM WS=128"
"147","2023-05-06 19:37:38.152043","192.168.18.48","2.17.179.243","TCP","54","50746  >  443 [ACK] Seq=1 Ack=1 Win=66304 Len=0"
"148","2023-05-06 19:37:38.152112","192.168.18.48","2.17.179.243","TCP","54","50756  >  443 [ACK] Seq=1 Ack=1 Win=66304 Len=0"
"149","2023-05-06 19:37:38.152279","2407:d000:b:7008:5d49:e746:bd25:c0b5","2a00:1450:4018:809::200e","UDP","91","58033  >  443 Len=29"
"150","2023-05-06 19:37:38.153295","192.168.18.48","2.17.179.243","TLSv1.2","251","Client Hello"
"151","2023-05-06 19:37:38.153295","192.168.18.48","2.17.179.243","TLSv1.2","251","Client Hello"
"152","2023-05-06 19:37:38.155653","2.17.179.243","192.168.18.48","TCP","66","443  >  50759 [SYN, ACK] Seq=0 Ack=1 Win=64240 Len=0 MSS=1412 SACK_PERM WS=128"
"153","2023-05-06 19:37:38.155745","192.168.18.48","2.17.179.243","TCP","54","50759  >  443 [ACK] Seq=1 Ack=1 Win=66304 Len=0"
"154","2023-05-06 19:37:38.156297","192.168.18.48","2.17.179.243","TLSv1.2","251","Client Hello"
"155","2023-05-06 19:37:38.160000","2.17.179.243","192.168.18.48","TCP","66","443  >  50752 [SYN, ACK] Seq=0 Ack=1 Win=64240 Len=0 MSS=1412 SACK_PERM WS=128"
"156","2023-05-06 19:37:38.160000","2.17.179.243","192.168.18.48","TCP","66","443  >  50762 [SYN, ACK] Seq=0 Ack=1 Win=64240 Len=0 MSS=1412 SACK_PERM WS=128"
"157","2023-05-06 19:37:38.160000","2.17.179.243","192.168.18.48","TCP","66","443  >  50765 [SYN, ACK] Seq=0 Ack=1 Win=64240 Len=0 MSS=1412 SACK_PERM WS=128"
"158","2023-05-06 19:37:38.160000","2.17.179.243","192.168.18.48","TCP","66","443  >  50766 [SYN, ACK] Seq=0 Ack=1 Win=64240 Len=0 MSS=1412 SACK_PERM WS=128"
"159","2023-05-06 19:37:38.160000","2.17.179.243","192.168.18.48","TCP","66","443  >  50758 [SYN, ACK] Seq=0 Ack=1 Win=64240 Len=0 MSS=1412 SACK_PERM WS=128"
"160","2023-05-06 19:37:38.160000","2.17.179.243","192.168.18.48","TCP","66","443  >  50760 [SYN, ACK] Seq=0 Ack=1 Win=64240 Len=0 MSS=1412 SACK_PERM WS=128"
"161","2023-05-06 19:37:38.160000","2.17.179.243","192.168.18.48","TCP","66","443  >  50757 [SYN, ACK] Seq=0 Ack=1 Win=64240 Len=0 MSS=1412 SACK_PERM WS=128"
"162","2023-05-06 19:37:38.160000","2.17.179.243","192.168.18.48","TCP","66","443  >  50761 [SYN, ACK] Seq=0 Ack=1 Win=64240 Len=0 MSS=1412 SACK_PERM WS=128"
"163","2023-05-06 19:37:38.160284","192.168.18.48","2.17.179.243","TCP","54","50752  >  443 [ACK] Seq=1 Ack=1 Win=66304 Len=0"
"164","2023-05-06 19:37:38.160364","192.168.18.48","2.17.179.243","TCP","54","50762  >  443 [ACK] Seq=1 Ack=1 Win=66304 Len=0"
"165","2023-05-06 19:37:38.160382","192.168.18.48","2.17.179.243","TCP","54","50765  >  443 [ACK] Seq=1 Ack=1 Win=66304 Len=0"
"166","2023-05-06 19:37:38.160398","192.168.18.48","2.17.179.243","TCP","54","50766  >  443 [ACK] Seq=1 Ack=1 Win=66304 Len=0"
"167","2023-05-06 19:37:38.160411","192.168.18.48","2.17.179.243","TCP","54","50758  >  443 [ACK] Seq=1 Ack=1 Win=66304 Len=0"
"168","2023-05-06 19:37:38.160423","192.168.18.48","2.17.179.243","TCP","54","50760  >  443 [ACK] Seq=1 Ack=1 Win=66304 Len=0"
"169","2023-05-06 19:37:38.160445","192.168.18.48","2.17.179.243","TCP","54","50757  >  443 [ACK] Seq=1 Ack=1 Win=66304 Len=0"
"170","2023-05-06 19:37:38.160456","192.168.18.48","2.17.179.243","TCP","54","50761  >  443 [ACK] Seq=1 Ack=1 Win=66304 Len=0"
"171","2023-05-06 19:37:38.160728","192.168.18.48","2.17.179.243","TLSv1.2","251","Client Hello"
"172","2023-05-06 19:37:38.160733","192.168.18.48","2.17.179.243","TLSv1.2","251","Client Hello"
"173","2023-05-06 19:37:38.160838","192.168.18.48","2.17.179.243","TLSv1.2","251","Client Hello"
"174","2023-05-06 19:37:38.160852","192.168.18.48","2.17.179.243","TLSv1.2","251","Client Hello"
"175","2023-05-06 19:37:38.160922","192.168.18.48","2.17.179.243","TLSv1.2","251","Client Hello"
"176","2023-05-06 19:37:38.160933","192.168.18.48","2.17.179.243","TLSv1.2","251","Client Hello"
"177","2023-05-06 19:37:38.161020","192.168.18.48","2.17.179.243","TLSv1.2","251","Client Hello"
"178","2023-05-06 19:37:38.161079","192.168.18.48","2.17.179.243","TLSv1.2","251","Client Hello"
"179","2023-05-06 19:37:38.161641","2.17.179.243","192.168.18.48","TCP","66","443  >  50768 [SYN, ACK] Seq=0 Ack=1 Win=64240 Len=0 MSS=1412 SACK_PERM WS=128"
"180","2023-05-06 19:37:38.161736","192.168.18.48","2.17.179.243","TCP","54","50768  >  443 [ACK] Seq=1 Ack=1 Win=66304 Len=0"
"181","2023-05-06 19:37:38.162380","192.168.18.48","2.17.179.243","TLSv1.2","251","Client Hello"
"182","2023-05-06 19:37:38.169663","2.17.179.243","192.168.18.48","TCP","66","443  >  50763 [SYN, ACK] Seq=0 Ack=1 Win=64240 Len=0 MSS=1412 SACK_PERM WS=128"
"183","2023-05-06 19:37:38.169749","192.168.18.48","2.17.179.243","TCP","54","50763  >  443 [ACK] Seq=1 Ack=1 Win=66304 Len=0"
"184","2023-05-06 19:37:38.170298","192.168.18.48","2.17.179.243","TLSv1.2","251","Client Hello"
"185","2023-05-06 19:37:38.170346","2.17.179.243","192.168.18.48","TCP","66","443  >  50764 [SYN, ACK] Seq=0 Ack=1 Win=64240 Len=0 MSS=1412 SACK_PERM WS=128"
"186","2023-05-06 19:37:38.170442","192.168.18.48","2.17.179.243","TCP","54","50764  >  443 [ACK] Seq=1 Ack=1 Win=66304 Len=0"
"187","2023-05-06 19:37:38.170911","192.168.18.48","2.17.179.243","TLSv1.2","251","Client Hello"
"188","2023-05-06 19:37:38.173867","2.17.179.243","192.168.18.48","TCP","66","443  >  50771 [SYN, ACK] Seq=0 Ack=1 Win=64240 Len=0 MSS=1412 SACK_PERM WS=128"
"189","2023-05-06 19:37:38.173867","2.17.179.243","192.168.18.48","TCP","66","443  >  50767 [SYN, ACK] Seq=0 Ack=1 Win=64240 Len=0 MSS=1412 SACK_PERM WS=128"
"190","2023-05-06 19:37:38.173867","2.17.179.243","192.168.18.48","TCP","66","443  >  50769 [SYN, ACK] Seq=0 Ack=1 Win=64240 Len=0 MSS=1412 SACK_PERM WS=128"
"191","2023-05-06 19:37:38.174019","192.168.18.48","2.17.179.243","TCP","54","50771  >  443 [ACK] Seq=1 Ack=1 Win=66304 Len=0"
"192","2023-05-06 19:37:38.174083","192.168.18.48","2.17.179.243","TCP","54","50767  >  443 [ACK] Seq=1 Ack=1 Win=66304 Len=0"
"193","2023-05-06 19:37:38.174094","192.168.18.48","2.17.179.243","TCP","54","50769  >  443 [ACK] Seq=1 Ack=1 Win=66304 Len=0"
"194","2023-05-06 19:37:38.174181","2.17.179.243","192.168.18.48","TCP","66","443  >  50773 [SYN, ACK] Seq=0 Ack=1 Win=64240 Len=0 MSS=1412 SACK_PERM WS=128"
"195","2023-05-06 19:37:38.174270","192.168.18.48","2.17.179.243","TCP","54","50773  >  443 [ACK] Seq=1 Ack=1 Win=66304 Len=0"
"196","2023-05-06 19:37:38.174588","192.168.18.48","2.17.179.243","TLSv1.2","251","Client Hello"
"197","2023-05-06 19:37:38.174588","192.168.18.48","2.17.179.243","TLSv1.2","251","Client Hello"
"198","2023-05-06 19:37:38.174602","192.168.18.48","2.17.179.243","TLSv1.2","251","Client Hello"
"199","2023-05-06 19:37:38.174704","192.168.18.48","2.17.179.243","TLSv1.2","251","Client Hello"
"200","2023-05-06 19:37:38.174745","2.17.179.243","192.168.18.48","TCP","66","443  >  50775 [SYN, ACK] Seq=0 Ack=1 Win=64240 Len=0 MSS=1412 SACK_PERM WS=128"
"201","2023-05-06 19:37:38.174822","192.168.18.48","2.17.179.243","TCP","54","50775  >  443 [ACK] Seq=1 Ack=1 Win=66304 Len=0"
"202","2023-05-06 19:37:38.175378","192.168.18.48","2.17.179.243","TLSv1.2","251","Client Hello"
"203","2023-05-06 19:37:38.177546","2.17.179.243","192.168.18.48","TCP","66","443  >  50778 [SYN, ACK] Seq=0 Ack=1 Win=64240 Len=0 MSS=1412 SACK_PERM WS=128"
"204","2023-05-06 19:37:38.177636","192.168.18.48","2.17.179.243","TCP","54","50778  >  443 [ACK] Seq=1 Ack=1 Win=66304 Len=0"
"205","2023-05-06 19:37:38.178064","192.168.18.48","2.17.179.243","TLSv1.2","251","Client Hello"
"206","2023-05-06 19:37:38.178271","2.17.179.243","192.168.18.48","TCP","66","443  >  50770 [SYN, ACK] Seq=0 Ack=1 Win=64240 Len=0 MSS=1412 SACK_PERM WS=128"
"207","2023-05-06 19:37:38.178334","192.168.18.48","2.17.179.243","TCP","54","50770  >  443 [ACK] Seq=1 Ack=1 Win=66304 Len=0"
"208","2023-05-06 19:37:38.178765","192.168.18.48","2.17.179.243","TLSv1.2","251","Client Hello"
"209","2023-05-06 19:37:38.179243","2.17.179.243","192.168.18.48","TCP","66","443  >  50776 [SYN, ACK] Seq=0 Ack=1 Win=64240 Len=0 MSS=1412 SACK_PERM WS=128"
"210","2023-05-06 19:37:38.179243","2.17.179.243","192.168.18.48","TCP","66","443  >  50774 [SYN, ACK] Seq=0 Ack=1 Win=64240 Len=0 MSS=1412 SACK_PERM WS=128"
"211","2023-05-06 19:37:38.179336","192.168.18.48","2.17.179.243","TCP","54","50776  >  443 [ACK] Seq=1 Ack=1 Win=66304 Len=0"
"212","2023-05-06 19:37:38.179388","192.168.18.48","2.17.179.243","TCP","54","50774  >  443 [ACK] Seq=1 Ack=1 Win=66304 Len=0"
"213","2023-05-06 19:37:38.179863","192.168.18.48","2.17.179.243","TLSv1.2","251","Client Hello"
"214","2023-05-06 19:37:38.179901","192.168.18.48","2.17.179.243","TLSv1.2","251","Client Hello"
"215","2023-05-06 19:37:38.185315","2.17.179.243","192.168.18.48","TCP","66","443  >  50772 [SYN, ACK] Seq=0 Ack=1 Win=64240 Len=0 MSS=1412 SACK_PERM WS=128"
"216","2023-05-06 19:37:38.185404","192.168.18.48","2.17.179.243","TCP","54","50772  >  443 [ACK] Seq=1 Ack=1 Win=66304 Len=0"
"217","2023-05-06 19:37:38.185962","192.168.18.48","2.17.179.243","TLSv1.2","251","Client Hello"
"218","2023-05-06 19:37:38.190785","2.17.179.243","192.168.18.48","TCP","66","443  >  50779 [SYN, ACK] Seq=0 Ack=1 Win=64240 Len=0 MSS=1412 SACK_PERM WS=128"
"219","2023-05-06 19:37:38.190893","192.168.18.48","2.17.179.243","TCP","54","50779  >  443 [ACK] Seq=1 Ack=1 Win=66304 Len=0"
"220","2023-05-06 19:37:38.191448","192.168.18.48","2.17.179.243","TLSv1.2","251","Client Hello"
"221","2023-05-06 19:37:38.193795","2.17.179.243","192.168.18.48","TCP","66","443  >  50777 [SYN, ACK] Seq=0 Ack=1 Win=64240 Len=0 MSS=1412 SACK_PERM WS=128"
"222","2023-05-06 19:37:38.193795","2.17.179.243","192.168.18.48","TCP","66","443  >  50783 [SYN, ACK] Seq=0 Ack=1 Win=64240 Len=0 MSS=1412 SACK_PERM WS=128"
"223","2023-05-06 19:37:38.193795","2.17.179.243","192.168.18.48","TCP","66","443  >  50782 [SYN, ACK] Seq=0 Ack=1 Win=64240 Len=0 MSS=1412 SACK_PERM WS=128"
"224","2023-05-06 19:37:38.193795","2.17.179.243","192.168.18.48","TCP","66","443  >  50780 [SYN, ACK] Seq=0 Ack=1 Win=64240 Len=0 MSS=1412 SACK_PERM WS=128"
"225","2023-05-06 19:37:38.193795","2.17.179.243","192.168.18.48","TCP","66","443  >  50781 [SYN, ACK] Seq=0 Ack=1 Win=64240 Len=0 MSS=1412 SACK_PERM WS=128"
"226","2023-05-06 19:37:38.193995","192.168.18.48","2.17.179.243","TCP","54","50777  >  443 [ACK] Seq=1 Ack=1 Win=66304 Len=0"
"227","2023-05-06 19:37:38.194073","192.168.18.48","2.17.179.243","TCP","54","50783  >  443 [ACK] Seq=1 Ack=1 Win=66304 Len=0"
"228","2023-05-06 19:37:38.194094","192.168.18.48","2.17.179.243","TCP","54","50782  >  443 [ACK] Seq=1 Ack=1 Win=66304 Len=0"
"229","2023-05-06 19:37:38.194107","192.168.18.48","2.17.179.243","TCP","54","50780  >  443 [ACK] Seq=1 Ack=1 Win=66304 Len=0"
"230","2023-05-06 19:37:38.194116","192.168.18.48","2.17.179.243","TCP","54","50781  >  443 [ACK] Seq=1 Ack=1 Win=66304 Len=0"
"231","2023-05-06 19:37:38.194701","192.168.18.48","2.17.179.243","TLSv1.2","251","Client Hello"
"232","2023-05-06 19:37:38.194701","192.168.18.48","2.17.179.243","TLSv1.2","251","Client Hello"
"233","2023-05-06 19:37:38.194701","192.168.18.48","2.17.179.243","TLSv1.2","251","Client Hello"
"234","2023-05-06 19:37:38.194838","192.168.18.48","2.17.179.243","TLSv1.2","251","Client Hello"
"235","2023-05-06 19:37:38.194911","192.168.18.48","2.17.179.243","TLSv1.2","251","Client Hello"
"236","2023-05-06 19:37:38.195038","2.17.179.243","192.168.18.48","TCP","66","443  >  50789 [SYN, ACK] Seq=0 Ack=1 Win=64240 Len=0 MSS=1412 SACK_PERM WS=128"
"237","2023-05-06 19:37:38.195038","2.17.179.243","192.168.18.48","TCP","66","443  >  50784 [SYN, ACK] Seq=0 Ack=1 Win=64240 Len=0 MSS=1412 SACK_PERM WS=128"
"238","2023-05-06 19:37:38.195155","192.168.18.48","2.17.179.243","TCP","54","50789  >  443 [ACK] Seq=1 Ack=1 Win=66304 Len=0"
"239","2023-05-06 19:37:38.195199","192.168.18.48","2.17.179.243","TCP","54","50784  >  443 [ACK] Seq=1 Ack=1 Win=66304 Len=0"
"240","2023-05-06 19:37:38.196112","192.168.18.48","2.17.179.243","TLSv1.2","251","Client Hello"
"241","2023-05-06 19:37:38.196112","192.168.18.48","2.17.179.243","TLSv1.2","251","Client Hello"
"242","2023-05-06 19:37:38.198902","2.17.179.243","192.168.18.48","TCP","66","443  >  50788 [SYN, ACK] Seq=0 Ack=1 Win=64240 Len=0 MSS=1412 SACK_PERM WS=128"
"243","2023-05-06 19:37:38.198902","2.17.179.243","192.168.18.48","TCP","66","443  >  50786 [SYN, ACK] Seq=0 Ack=1 Win=64240 Len=0 MSS=1412 SACK_PERM WS=128"
"244","2023-05-06 19:37:38.198902","2.17.179.243","192.168.18.48","TCP","66","443  >  50785 [SYN, ACK] Seq=0 Ack=1 Win=64240 Len=0 MSS=1412 SACK_PERM WS=128"
"245","2023-05-06 19:37:38.198902","2.17.179.243","192.168.18.48","TCP","66","443  >  50796 [SYN, ACK] Seq=0 Ack=1 Win=64240 Len=0 MSS=1412 SACK_PERM WS=128"
"246","2023-05-06 19:37:38.199095","192.168.18.48","2.17.179.243","TCP","54","50788  >  443 [ACK] Seq=1 Ack=1 Win=66304 Len=0"
"247","2023-05-06 19:37:38.199161","192.168.18.48","2.17.179.243","TCP","54","50786  >  443 [ACK] Seq=1 Ack=1 Win=66304 Len=0"
"248","2023-05-06 19:37:38.199174","192.168.18.48","2.17.179.243","TCP","54","50785  >  443 [ACK] Seq=1 Ack=1 Win=66304 Len=0"
"249","2023-05-06 19:37:38.199185","192.168.18.48","2.17.179.243","TCP","54","50796  >  443 [ACK] Seq=1 Ack=1 Win=66304 Len=0"
"250","2023-05-06 19:37:38.199735","192.168.18.48","2.17.179.243","TLSv1.2","251","Client Hello"
"251","2023-05-06 19:37:38.199819","192.168.18.48","2.17.179.243","TLSv1.2","251","Client Hello"
"252","2023-05-06 19:37:38.199866","192.168.18.48","2.17.179.243","TLSv1.2","251","Client Hello"
"253","2023-05-06 19:37:38.199896","192.168.18.48","2.17.179.243","TLSv1.2","251","Client Hello"
"254","2023-05-06 19:37:38.200193","2.17.179.243","192.168.18.48","TCP","66","443  >  50798 [SYN, ACK] Seq=0 Ack=1 Win=64240 Len=0 MSS=1412 SACK_PERM WS=128"
"255","2023-05-06 19:37:38.200304","192.168.18.48","2.17.179.243","TCP","54","50798  >  443 [ACK] Seq=1 Ack=1 Win=66304 Len=0"
"256","2023-05-06 19:37:38.200933","2a00:1450:4018:809::200e","2407:d000:b:7008:5d49:e746:bd25:c0b5","UDP","88","443  >  58033 Len=26"
"257","2023-05-06 19:37:38.200950","192.168.18.48","2.17.179.243","TLSv1.2","251","Client Hello"
"258","2023-05-06 19:37:38.201523","2.17.179.243","192.168.18.48","TCP","66","443  >  50790 [SYN, ACK] Seq=0 Ack=1 Win=64240 Len=0 MSS=1412 SACK_PERM WS=128"
"259","2023-05-06 19:37:38.201523","2.17.179.243","192.168.18.48","TCP","66","443  >  50793 [SYN, ACK] Seq=0 Ack=1 Win=64240 Len=0 MSS=1412 SACK_PERM WS=128"
"260","2023-05-06 19:37:38.201671","192.168.18.48","2.17.179.243","TCP","54","50790  >  443 [ACK] Seq=1 Ack=1 Win=66304 Len=0"
"261","2023-05-06 19:37:38.201740","192.168.18.48","2.17.179.243","TCP","54","50793  >  443 [ACK] Seq=1 Ack=1 Win=66304 Len=0"
"262","2023-05-06 19:37:38.202365","192.168.18.48","2.17.179.243","TLSv1.2","251","Client Hello"
"263","2023-05-06 19:37:38.202401","192.168.18.48","2.17.179.243","TLSv1.2","251","Client Hello"
"264","2023-05-06 19:37:38.204795","2.17.179.243","192.168.18.48","TCP","66","443  >  50795 [SYN, ACK] Seq=0 Ack=1 Win=64240 Len=0 MSS=1412 SACK_PERM WS=128"
"265","2023-05-06 19:37:38.204893","192.168.18.48","2.17.179.243","TCP","54","50795  >  443 [ACK] Seq=1 Ack=1 Win=66304 Len=0"
"266","2023-05-06 19:37:38.205489","192.168.18.48","2.17.179.243","TLSv1.2","251","Client Hello"
"267","2023-05-06 19:37:38.205521","2.17.179.243","192.168.18.48","TCP","66","443  >  50787 [SYN, ACK] Seq=0 Ack=1 Win=64240 Len=0 MSS=1412 SACK_PERM WS=128"
"268","2023-05-06 19:37:38.205614","192.168.18.48","2.17.179.243","TCP","54","50787  >  443 [ACK] Seq=1 Ack=1 Win=66304 Len=0"
"269","2023-05-06 19:37:38.206138","192.168.18.48","2.17.179.243","TLSv1.2","251","Client Hello"
"270","2023-05-06 19:37:38.210603","2.17.179.243","192.168.18.48","TCP","66","443  >  50794 [SYN, ACK] Seq=0 Ack=1 Win=64240 Len=0 MSS=1412 SACK_PERM WS=128"
"271","2023-05-06 19:37:38.210603","2.17.179.243","192.168.18.48","TCP","66","443  >  50792 [SYN, ACK] Seq=0 Ack=1 Win=64240 Len=0 MSS=1412 SACK_PERM WS=128"
"272","2023-05-06 19:37:38.210751","192.168.18.48","2.17.179.243","TCP","54","50794  >  443 [ACK] Seq=1 Ack=1 Win=66304 Len=0"
"273","2023-05-06 19:37:38.210822","192.168.18.48","2.17.179.243","TCP","54","50792  >  443 [ACK] Seq=1 Ack=1 Win=66304 Len=0"
"274","2023-05-06 19:37:38.210881","2.17.179.243","192.168.18.48","TCP","66","443  >  50791 [SYN, ACK] Seq=0 Ack=1 Win=64240 Len=0 MSS=1412 SACK_PERM WS=128"
"275","2023-05-06 19:37:38.210940","192.168.18.48","2.17.179.243","TCP","54","50791  >  443 [ACK] Seq=1 Ack=1 Win=66304 Len=0"
"276","2023-05-06 19:37:38.211412","192.168.18.48","2.17.179.243","TLSv1.2","251","Client Hello"
"277","2023-05-06 19:37:38.211475","192.168.18.48","2.17.179.243","TLSv1.2","251","Client Hello"
"278","2023-05-06 19:37:38.211491","192.168.18.48","2.17.179.243","TLSv1.2","251","Client Hello"
"279","2023-05-06 19:37:38.211704","2.17.179.243","192.168.18.48","TCP","66","443  >  50799 [SYN, ACK] Seq=0 Ack=1 Win=64240 Len=0 MSS=1412 SACK_PERM WS=128"
"280","2023-05-06 19:37:38.211704","2.17.179.243","192.168.18.48","TCP","66","443  >  50800 [SYN, ACK] Seq=0 Ack=1 Win=64240 Len=0 MSS=1412 SACK_PERM WS=128"
"281","2023-05-06 19:37:38.211704","2.17.179.243","192.168.18.48","TCP","54","443  >  50599 [ACK] Seq=4155 Ack=490 Win=64128 Len=0"
"282","2023-05-06 19:37:38.211890","192.168.18.48","2.17.179.243","TCP","54","50799  >  443 [ACK] Seq=1 Ack=1 Win=66304 Len=0"
"283","2023-05-06 19:37:38.211959","192.168.18.48","2.17.179.243","TCP","54","50800  >  443 [ACK] Seq=1 Ack=1 Win=66304 Len=0"
"284","2023-05-06 19:37:38.212562","192.168.18.48","2.17.179.243","TLSv1.2","251","Client Hello"
"285","2023-05-06 19:37:38.212605","192.168.18.48","2.17.179.243","TLSv1.2","251","Client Hello"
"286","2023-05-06 19:37:38.213703","2.17.179.243","192.168.18.48","TCP","66","443  >  50797 [SYN, ACK] Seq=0 Ack=1 Win=64240 Len=0 MSS=1412 SACK_PERM WS=128"
"287","2023-05-06 19:37:38.213817","192.168.18.48","2.17.179.243","TCP","54","50797  >  443 [ACK] Seq=1 Ack=1 Win=66304 Len=0"
"288","2023-05-06 19:37:38.214571","192.168.18.48","2.17.179.243","TLSv1.2","251","Client Hello"
"289","2023-05-06 19:37:38.234009","2.17.179.243","192.168.18.48","TCP","1466","443  >  50599 [ACK] Seq=4155 Ack=490 Win=64128 Len=1412 [TCP segment of a reassembled PDU]"
"290","2023-05-06 19:37:38.237351","2.17.179.243","192.168.18.48","TLSv1.2","555","Application Data"
"291","2023-05-06 19:37:38.237426","192.168.18.48","2.17.179.243","TCP","54","50599  >  443 [ACK] Seq=490 Ack=6068 Win=66304 Len=0"
"292","2023-05-06 19:37:38.238346","192.168.18.48","2.17.179.243","TLSv1.2","85","Encrypted Alert"
"293","2023-05-06 19:37:38.238523","192.168.18.48","2.17.179.243","TCP","54","50599  >  443 [FIN, ACK] Seq=521 Ack=6068 Win=66304 Len=0"
"294","2023-05-06 19:37:38.241613","2.17.179.243","192.168.18.48","TCP","54","443  >  50722 [ACK] Seq=1 Ack=198 Win=64128 Len=0"
"295","2023-05-06 19:37:38.242117","2.17.179.243","192.168.18.48","TCP","66","443  >  50803 [SYN, ACK] Seq=0 Ack=1 Win=64240 Len=0 MSS=1412 SACK_PERM WS=128"
"296","2023-05-06 19:37:38.242208","192.168.18.48","2.17.179.243","TCP","54","50803  >  443 [ACK] Seq=1 Ack=1 Win=66304 Len=0"
"297","2023-05-06 19:37:38.242697","192.168.18.48","2.17.179.243","TLSv1.2","251","Client Hello"
"298","2023-05-06 19:37:38.248705","2.17.179.243","192.168.18.48","TCP","66","443  >  50802 [SYN, ACK] Seq=0 Ack=1 Win=64240 Len=0 MSS=1412 SACK_PERM WS=128"
"299","2023-05-06 19:37:38.248780","192.168.18.48","2.17.179.243","TCP","54","50802  >  443 [ACK] Seq=1 Ack=1 Win=66304 Len=0"
"300","2023-05-06 19:37:38.249399","192.168.18.48","2.17.179.243","TLSv1.2","251","Client Hello"
